index,published,topic,term,domain,language,valid,de,title,description,en,la,url,image,archive,content,quote,added,feed,country,ipcc,continent
378c93a9e84adede6fbbf18712304526,2026-01-20T13:08:00Z,Snow&Ice,vorst,www.nieuwsblad.be,nl,0.7,"Skelett eines vermissten Mannes nach fast 23 Jahren im Wald gefunden. Bei Renovierungsarbeiten an einem Haus in der Brüsseler Gemeinde Forest wurde im Keller ein Skelett gefunden. Es stellt sich heraus, dass es sich um einen Mann handelt, der seit fast 23 Jahren vermisst wurde.",Skelet van vermiste man na bijna 23 jaar teruggevonden in Vorst,In de Brusselse gemeente Vorst is tijdens renovatiewerken aan een woning een skelet aangetroffen in de kelder. Het blijkt te gaan om een man die al bijna 23 jaar vermist was.,Skeleton of missing man found in Forest after almost 23 years. A skeleton was found in the basement during renovation work on a house in the Brussels municipality of Forest. It turns out to be a man who had been missing for almost 23 years.,Ossa absentis bominis in Foresta post fere 23 annos. Osseus in cella inventa est inter renovationem operis in domo in municipio saltus Bruxellis. Evenit ut vir qui per XXIII annos fere defuerat.,https://www.nieuwsblad.be/regio/brussel/vorst/skelet-van-vermiste-man-na-bijna-23-jaar-teruggevonden-in-vorst/125127148.html,https://prod-img.nieuwsblad.be/public/nieuws/cx4hth-bpmedia-document-405910.jpg/alternates/SIXTEEN_NINE_1200/bpmedia-document-405910.jpg,,"Bouwvakkers waren op woensdag 16 juli 2025 aan de slag in een woning in de Korporaal Trésigniesstraat in Vorst toen zij in de kelder een lugubere ontdekking deden: een skelet.
Na onderzoek bleek het… [+522 chars]",,2026-01-25 03:01:59+00:00,random,,,
4295eb0d21853fe3d059633cf799bd39,2026-01-11T13:49:42Z,Snow&Ice,vorst,www.nrc.nl,nl,0.9,"Auch NS fährt am Montag mit einem angepassten Fahrplan. Auch die Züge der Niederländischen Eisenbahnen (NS) verkehren am Montag nach einem angepassten Fahrplan. „Aufgrund des Frosts und Schnees der letzten Tage steht noch nicht die volle Anzahl der benötigten Züge zur Verfügung“, schreibt die NS.…",NS rijdt ook maandag nog met een aangepaste dienstregeling,"De treinen van de Nederlandse Spoorwegen (NS) rijden ook maandag nog volgens een aangepaste dienstregeling. „De nasleep van de vorst en sneeuw van afgelopen dagen betekent dat het volledige aantal benodigde treinen nu nog niet beschikbaar is”, schrijft de NS.…","NS will also run with an adjusted timetable on Monday. The trains of the Dutch Railways (NS) will also run according to an adjusted timetable on Monday. “The aftermath of the frost and snow of recent days means that the full number of required trains is not yet available,” writes the NS.…","NS etiam perget operari cum accommodata intermittit die Lunae. Impedimenta Railviae Batavica (NS) etiam currunt secundum tempus accommodatum die Lunae. ""Secundata pruinae et nivis recentium dierum significat plenum numerum impedimentorum requisitorum nondum in promptu esse"" scribit NS...",https://www.nrc.nl/nieuws/2026/01/11/ns-rijdt-ook-maandag-nog-met-een-aangepaste-dienstregeling-a4917385,https://images.nrc.nl/N7h1zYxLi2QRvlmezgIv9yrcqU8=/1200x627/smart/filters:no_upscale()/s3/static.nrc.nl/wp-content/uploads/2026/01/11142225/110126VER_2029702492_trein.jpg,,De treinen van de Nederlandse Spoorwegen (NS) rijden ook maandag nog volgens een aangepaste dienstregeling. De nasleep van de vorst en sneeuw van afgelopen dagen betekent dat het volledige aantal ben… [+667 chars],,2026-01-25 03:01:59+00:00,random,,,
7ec405da223670ee7a522d2d19aab23b,2026-01-07T07:44:36Z,Drought,gebrek aan regen suriname,www.hbvl.be,nl,0.2,"Mit viel Liebe zum Detail: Wie sich Nicky Hayen bei einem Praktikum in Marbella beim KRC Genk sofort durchsetzte. Für den KRC Genk in Marbella ist der Kopf frei. Nach einem langen Reisetag trainierten wir noch zwei Stunden. Es war auffällig, wie Trainer Nicky Hayen delegierte, sich aber dennoch sofort durchsetzte. Mit viel Liebe zum Detail.",Met veel oog voor detail: hoe Nicky Hayen zich meteen laat gelden bij KRC Genk op stage in Marbella,"De kop is eraf voor KRC Genk in Marbella. Na een lange reisdag werd alsnog twee uur getraind. Opvallend was hoe coach Nicky Hayen delegeerde, maar zich toch meteen liet gelden. Met veel oog voor detail.","With a great eye for detail: how Nicky Hayen immediately asserted himself at KRC Genk on an internship in Marbella. The head is off for KRC Genk in Marbella. After a long travel day, we still trained for two hours. It was striking how coach Nicky Hayen delegated, but still immediately asserted himself. With a lot of attention to detail.","Oculo perspicacissimo: quomodo Nicky Hayen statim se KRC Genk in Marbella in interna- tione asseruit. Pro KRC Genk in Marbella caput differtur. Post longam peregrinationem diem adhuc duas horas erudiebamus. Percussum erat quomodo raeda Nicky Hayen delegavit, sed tamen statim se ipsum asseruit. Cum multam operam in speciali.",https://www.hbvl.be/sport/voetbal/met-oog-voor-detail-genk-coach-nicky-hayen-laat-zich-meteen-gelden-in-marbella/121729054.html,https://prod-img.hbvl.be/public/nieuws/y91bpa-karetsas-en-co.-trainen-met-palmbomen-op-achtergrond.jpeg/alternates/SIXTEEN_NINE_1200/Karetsas%20en%20co.%20trainen%20met%20palmbomen%20op%20achtergrond.jpeg,,"PremiumSOS Haar. Ziet je haar af van de kou? Dit kan je eraan doen
IJskoud weer en verwarming maken de lucht droog. Die droge lucht heeft een impact op je haar. Het wordt droog, statisch, kortom: on… [+188 chars]",,2026-01-25 10:49:27+00:00,edo,Suriname,NSA,South-America
04297cd5293ce5f447871e37f49c4af5,2026-01-07T13:45:00Z,Earthquake,aardbeving agats,www.nieuwsblad.be,nl,0.2,"Prostitutionsverfahren gegen Ex-Mann Barbara Gandolfi (50) verschoben: Opfer verlangt plötzlich hohe Geldsumme von ehemaliger „Temptation Island“-Verführerin. Der Strafprozess gegen das ehemalige Playboy-Model Barbara Gandolfi (50), ihren Ex-Partner Frédéric V. (51) und drei weitere wurde um einen Monat verschoben. Eine plötzliche Schadensersatzforderung eines mutmaßlichen Opfers ist eine davon. Frédéric V. würde von seinem…",Prostitutiezaak tegen ex-man Barbara Gandolfi (50) uitgesteld: slachtoffer eist plots riante geldsom van voormalig ‘Temptation Island’-verleidster,"Het strafproces tegen voormalig Playboy-model Barbara Gandolfi (50), haar ex-partner Frédéric V. (51) en nog drie anderen is met een maand uitgesteld. Een plotse schadeclaim van een vermeend slachtoffer zit daar voor alles tussen. Frédéric V. zou vanuit zijn …","Prostitution case against ex-husband Barbara Gandolfi (50) postponed: victim suddenly demands a large sum of money from former 'Temptation Island' temptress. The criminal trial against former Playboy model Barbara Gandolfi (50), her ex-partner Frédéric V. (51) and three others has been postponed for a month. A sudden claim for damages from an alleged victim is one of them. Frédéric V. would from his…","Causa fornicationis contra ex- virum Barbarae Gandolfi (50) distulit: victima subito magnam pecuniae summam petit a pristino 'Temptatione Island' tentator. Criminalis iudicium contra pristinum exemplar Barbara Playboy Gandolfi (50), socium suum Fredéric V. (51) et tres alios in mensem prorogatum est. Subita petitio damnorum ex victima allata est una ex illis. Frédéric V. utinam ab eius ...",https://www.nieuwsblad.be/binnenland/prostitutiezaak-tegen-ex-man-barbara-gandolfi-50-uitgesteld-slachtoffer-eist-plots-riante-geldsom-van-voormalig-temptation-island-verleidster/122019202.html,https://prod-img.nieuwsblad.be/public/nieuws/m2w72o-barbara-gandolfi-en-haar-advocaat-louis-de-groote-verlaten-het-brugse-gerechtsgebouw-nadat-het-proces-rond-uitbuiting-van-prostituees-werd-uitgesteld./alternates/SIXTEEN_NINE_1200/Barbara%20Gandolfi%20en%20haar%20advocaat%20Louis%20De%20Groote%20verlaten%20het%20Brugse%20gerechtsgebouw%20nadat%20het%20proces%20rond%20uitbuiting%20van%20prostituees%20werd%20uitgesteld.,,"PremiumSOS Haar. Ziet je haar af van de kou? Dit kan je eraan doen
IJskoud weer en verwarming maken de lucht droog. Die droge lucht heeft een impact op je haar. Het wordt droog, statisch, kortom: on… [+188 chars]",,2026-01-25 10:49:27+00:00,usgs,Indonesia,SEA,Asia
c8d20fb977635fd71f42db00094784d9,2026-01-07T15:15:00Z,Precipitation,neerslag maluku,www.nieuwsblad.be,nl,0.2,"Wenige Wochen nach der Übernahme musste Lorenzo seinen Gastronomiebetrieb wegen eines Brandes schließen: „Wir waren bereit zur Eröffnung.“ Die Inszenierung wurde gerade fertiggestellt. Lorenzo Van Moerkercke und sein Team waren bereit, die Türen von Balthasar in Brügge zu öffnen. Bis plötzlich Wasser von der Decke tropfte und einige Passanten Rauch bemerkten. Ein Schornsteinbrand zerstörte ein ganzes Gebäude mit Ausrüstung…",Enkele weken na overname moet Lorenzo zijn horecazaak sluiten door brand: “We stonden klaar om open te gaan”,De mise-en-place zat er net op. Lorenzo Van Moerkercke stond met zijn team klaar om de deuren te openen van Balthasar in Brugge. Tot er plots water uit het plafond druppelde en er enkele passanten rook opmerkten. Een schouwbrand had een volledig pand met appa…,"A few weeks after taking over, Lorenzo had to close his catering business due to fire: “We were ready to open.” The mise en place was just finished. Lorenzo Van Moerkercke and his team were ready to open the doors of Balthasar in Bruges. Until suddenly water dripped from the ceiling and some passers-by noticed smoke. A chimney fire destroyed an entire building with equipment…","Paucis post hebdomadibus accepto, Laurentius negotium obsonationis ob incendium suum claudere debuit: ""Parati sumus aperire."" The mise en place was just finished. Lorenzo Van Moerkercke et turmae paratae erant ianuas Balthasar Brugis aperire. Donec subito aquae e lacunari stillarunt, et praetereuntes fumum animadverterunt. Ignis camino totum aedificium cum apparatu destruxit…",https://www.nieuwsblad.be/binnenland/enkele-weken-na-overname-moet-lorenzo-zijn-horecazaak-sluiten-door-brand-we-stonden-klaar-om-open-te-gaan/122048530.html,https://prod-img.nieuwsblad.be/public/nieuws/rkhf18-zaakvoerder-lorenzo-van-moerkercke-van-balthasar-brugge./alternates/SIXTEEN_NINE_1200/Zaakvoerder%20Lorenzo%20Van%20Moerkercke%20van%20Balthasar%20Brugge.,,"PremiumSOS Haar. Ziet je haar af van de kou? Dit kan je eraan doen
IJskoud weer en verwarming maken de lucht droog. Die droge lucht heeft een impact op je haar. Het wordt droog, statisch, kortom: on… [+188 chars]",,2026-01-25 10:49:27+00:00,wmo,Indonesia,SEA,Asia
47fd0bee4a1ee7e631eaac12f676cb14,2026-01-07T15:37:00Z,Drought,gebrek aan regen bonaire sint eustatius en saba,www.nieuwsblad.be,nl,0.2,"Ist das der Grund für das Interesse an Grönland? Amerikanische Tech-Milliardäre wollen einen libertären High-Tech-Stadtstaat aufbauen. Hat Präsident Donald Trump neben der „nationalen Sicherheit“, den Ressourcen und dem Prestige noch weitere Gründe für die Annexion Grönlands? Auf jeden Fall prüfte eine Gruppe amerikanischer Tech-Milliardäre bereits die Möglichkeit, die High-Tech-Freiheit zu nutzen...",Is dát de reden voor de interesse in Groenland? Amerikaanse techmiljardairs willen er een hoogtechnologische libertaire stadstaat bouwen,"Heeft president Donald Trump, naast de “nationale veiligheid”, de grondstoffen en het prestige, nog een bijkomende reden om Groenland te annexeren? Een kransje Amerikaanse techmiljardairs bekeek in ieder geval al de mogelijkheid om de hoogtechnologische liber…","Is that the reason for the interest in Greenland? American tech billionaires want to build a high-tech libertarian city-state. Does President Donald Trump have any additional reason to annex Greenland, besides “national security,” resources and prestige? In any case, a group of American tech billionaires were already looking at the possibility of using the high-tech liber...","Estne causa interest in Groenlandiae? American tech billionaires altam tech libertatem civitatis civitatis aedificare volunt. Praeses Donald Trump habet ullam causam additam adiungendi Groenlandiae, praeter ""Securitatem nationalem"", facultates et praestantiam? Ceterum, coetus technicorum Americanorum billionaires iam spectabant facultatem utendi summus tech liber...",https://www.nieuwsblad.be/buitenland/is-dat-de-reden-voor-de-interesse-in-groenland-amerikaanse-techmiljardairs-willen-er-een-hoogtechnologische-libertaire-stadstaat-bouwen/122038668.html,https://prod-img.nieuwsblad.be/public/nieuws/s13v6d-collage-flexible-20260107.webp/alternates/SIXTEEN_NINE_1200/collage-flexible-20260107.webp,,"PremiumSOS Haar. Ziet je haar af van de kou? Dit kan je eraan doen
IJskoud weer en verwarming maken de lucht droog. Die droge lucht heeft een impact op je haar. Het wordt droog, statisch, kortom: on… [+188 chars]",,2026-01-25 10:49:27+00:00,edo,Bonaire; Saint Eustatius and Saba ,CAR,North-America
f5317b82c591e11db7037c0f4879a0ef,2026-01-07T16:00:00Z,Earthquake,aardbeving,www.nieuwsblad.be,nl,0.2,"Warum die Übernahme Venezuelas für Putin eine kostspielige Demütigung ist: „Sie haben nicht einmal die russischen Sicherheitskräfte bezahlt.“ Aus dem Kreml kam noch keine Nachricht über den amerikanischen Überfall auf Venezuela. Dafür gibt es einen Grund: Wladimir Putin glaubt zwar fest an das Überleben des Stärksten, aber der Sturz Maduros ist vor allem eine kostspielige Demütigung.",Waarom overname van Venezuela dure vernedering is voor Poetin: “Ze hebben niet eens de Russische veiligheidstroepen betaald”,"Nog geen woord is er uit het Kremlin gekomen over de Amerikaanse raid op Venezuela. Daar is een reden voor: Vladimir Poetin mag dan gesterkt zijn in zijn geloof in het recht van de sterkste, de val van Maduro is vooral een kostelijke vernedering.","Why taking over Venezuela is a costly humiliation for Putin: “They didn't even pay the Russian security forces.” No word has yet come from the Kremlin about the American raid on Venezuela. There is a reason for this: Vladimir Putin may be strong in his belief in the survival of the strongest, but the fall of Maduro is above all a costly humiliation.","Cur Venezuela accipiendo pretiosa est humilitas pro Putin: ""Non etiam copias securitatis Russiae solvebant"". Nullum verbum adhuc ex Kremlin venit de praeda Americana in Venetiola. Causa huius rei est: Vladimir Putin valere potest in sua opinione superstes fortissimae, sed casus Maduro super omnia est pretiosa humilitas.",https://www.nieuwsblad.be/binnenland/waarom-overname-van-venezuela-dure-vernedering-is-voor-poetin-ze-hebben-niet-eens-de-russische-veiligheidstroepen-betaald/122032576.html,https://prod-img.nieuwsblad.be/public/nieuws/5mr3j7-file-photo-russian-president-putin-and-venezuelan-president-maduro-meet-in-moscow/alternates/SIXTEEN_NINE_1200/FILE%20PHOTO%20Russian%20President%20Putin%20and%20Venezuelan%20President%20Maduro%20meet%20in%20Moscow,,"PremiumSOS Haar. Ziet je haar af van de kou? Dit kan je eraan doen
IJskoud weer en verwarming maken de lucht droog. Die droge lucht heeft een impact op je haar. Het wordt droog, statisch, kortom: on… [+188 chars]",,2026-01-25 10:49:27+00:00,random,,,
600497bcbddd34fe5aa2322a6218ab0d,2026-01-07T16:00:00Z,Fog,mist antwerpen,www.nieuwsblad.be,nl,0.2,"Warum die Übernahme Venezuelas durch die USA für Putin eine kostspielige Demütigung ist: „Er wird sich in seinem Glauben an das Gesetz des Stärkeren gestärkt fühlen.“ Aus dem Kreml kam noch keine Nachricht über den amerikanischen Überfall auf Venezuela. Dafür gibt es einen Grund: Wladimir Putin glaubt zwar fest an das Überleben des Stärksten, aber der Sturz Maduros ist eine sehr kostspielige Demütigung.",Waarom de overname van Venezuela door de VS een dure vernedering is voor Poetin: “Hij zal zich gesterkt voelen in zijn geloof in het recht van de sterkste”,"Nog geen woord is er uit het Kremlin gekomen over de Amerikaanse raid op Venezuela. Daar is een reden voor: Vladimir Poetin mag dan gesterkt zijn in zijn geloof in het recht van de sterkste, de val van Maduro is een heel kostelijke vernedering.","Why the US takeover of Venezuela is a costly humiliation for Putin: “He will feel strengthened in his belief in the law of the strongest.” No word has yet come from the Kremlin about the American raid on Venezuela. There is a reason for this: Vladimir Putin may be strong in his belief in the survival of the strongest, but the fall of Maduro is a very costly humiliation.","Cur US Venezuela sumptuosa humiliatio est pro Putin: ""Confortetur in sua fide fortissimis legi."" Nullum verbum adhuc ex Kremlin venit de praeda Americana in Venetiola. Causa huius rei est: Vladimir Putin valere potest in sua opinione superstes fortissimae, sed casus Maduro valde pretiosus est humiliatio.",https://www.nieuwsblad.be/binnenland/waarom-de-overname-van-venezuela-door-de-vs-een-dure-vernedering-is-voor-poetin-hij-zal-zich-gesterkt-voelen-in-zijn-geloof-in-het-recht-van-de-sterkste/122032576.html,https://prod-img.nieuwsblad.be/public/nieuws/5mr3j7-file-photo-russian-president-putin-and-venezuelan-president-maduro-meet-in-moscow/alternates/SIXTEEN_NINE_1200/FILE%20PHOTO%20Russian%20President%20Putin%20and%20Venezuelan%20President%20Maduro%20meet%20in%20Moscow,,"PremiumSOS Haar. Ziet je haar af van de kou? Dit kan je eraan doen
IJskoud weer en verwarming maken de lucht droog. Die droge lucht heeft een impact op je haar. Het wordt droog, statisch, kortom: on… [+188 chars]",,2026-01-25 10:49:27+00:00,wmo,Belgium,WCE,Europe
fdbea1477108eee9dced3f8a19695193,2026-01-07T16:59:44Z,Precipitation,regen bali,www.nieuwsblad.be,nl,0.2,"Amsterdam stellt 140.000 Euro für die Rehabilitierung eines Notars frei, der fälschlicherweise als Anne-Frank-Verräter identifiziert wurde. Amsterdam investiert einen Zuschuss von 140.000 Euro in eine Biografie von Arnold van den Bergh. Der Notar wurde 2022 als der Mann identifiziert, der Anne Frank an die Deutschen verraten hatte. Zu Unrecht, wie sich herausstellte. Die nun veröffentlichte Lebensgeschichte über ihn soll…",Amsterdam maakt 140.000 euro vrij voor eerherstel notaris die onterecht als verrader van Anne Frank werd aangewezen,"Amsterdam steekt 140.000 euro subsidie in een biografie over Arnold van den Bergh. De notaris was in 2022 aangewezen als de man die Anne Frank verraadde bij de Duitsers. Ten onrechte, zo bleek. Het levensverhaal dat nu over hem zal verschijnen, is bedoeld als…","Amsterdam is releasing 140,000 euros for the rehabilitation of a notary who was wrongly identified as a traitor to Anne Frank. Amsterdam is investing a subsidy of 140,000 euros in a biography of Arnold van den Bergh. The notary was identified in 2022 as the man who betrayed Anne Frank to the Germans. Wrongly, as it turned out. The life story that will now be published about him is intended as…","Amstelodami 140.000 nummorum dimittit pro restauratione notarii qui falso Annae Frank proditor notus est. Amstelodami subsidium 140.000 euronum in biographia Arnoldi van den Bergh investit. Notarius notus est anno 2022 sicut vir qui Annam Frank Germanorum tradidit. Male, quod evenit. Narratio vitae quae de eo nunc divulgabitur, destinatur sicut ...",https://www.nieuwsblad.be/buitenland/amsterdam-maakt-140.000-euro-vrij-voor-eerherstel-notaris-die-onterecht-als-verrader-van-anne-frank-werd-aangewezen/122130514.html,https://prod-img.nieuwsblad.be/public/nieuws/rhmy12-photosplitter-1767804881974.jpg/alternates/SIXTEEN_NINE_1200/photosplitter-1767804881974.jpg,,"PremiumSOS Haar. Ziet je haar af van de kou? Dit kan je eraan doen
IJskoud weer en verwarming maken de lucht droog. Die droge lucht heeft een impact op je haar. Het wordt droog, statisch, kortom: on… [+188 chars]",,2026-01-25 10:49:27+00:00,wmo,Indonesia,SEA,Asia
28ac8b0e5d4dad08af3ca1b416c6d0a4,2026-01-07T18:21:28Z,ice jam,overstromingen,www.nieuwsblad.be,nl,0.2,"Nach der siebenjährigen Haftstrafe ihres Mannes wegen Folter: Wie außergewöhnlich ist Partnergewalt von Frauen? „Psychologische Manipulation kann weit gehen.“ In Turnhout wird eine Frau wegen extremer Misshandlung ihres Mannes zu sieben Jahren Gefängnis verurteilt. Wie oft ist die Frau selbst Täterin von Partnergewalt? Und warum greift ein männliches Opfer nicht ein? „Wenn ein Mann Widerstand leistet, wird ihm oft vorgeworfen, …",Na de zeven jaar cel voor foltering van haar man: hoe uitzonderlijk is partnergeweld door vrouwen? “Psychologische manipulatie kan ver gaan”,"In Turnhout krijgt een vrouw zeven jaar cel, voor de extreme mishandeling van haar man. Hoe vaak is de vrouw zélf pleger van partnergeweld? En waarom grijpt een mannelijk slachtoffer niet in? “Als een man zich verzet, krijgt hij dikwijls het verwijt dat hij z…","After her husband's seven-year prison sentence for torture: how exceptional is intimate partner violence by women? “Psychological manipulation can go far.” In Turnhout, a woman receives seven years in prison for the extreme abuse of her husband. How often is the woman herself a perpetrator of intimate partner violence? And why doesn't a male victim intervene? “When a man resists, he is often accused of…","Post septem annos mariti sui carceris sententiam pro cruciatu dixit: quam eximia est intima violentia a feminis particeps? ""Psychologicum manipulation possunt ire procul."" In Turnhout mulier septem annos in carcere ob nimiam mariti abusum accipit. Quoties ipsa mulier est violentiae particeps intimae perpetrator? Et cur non intervenit masculus victima? “Cum quis resistit, saepe accusatus est.",https://www.nieuwsblad.be/binnenland/na-de-zeven-jaar-cel-voor-foltering-van-haar-man-hoe-uitzonderlijk-is-partnergeweld-door-vrouwen-psychologische-manipulatie-kan-ver-gaan/122041967.html,https://prod-img.nieuwsblad.be/public/nieuws/cmlifg-photosplitter-1767805726339.png/alternates/SIXTEEN_NINE_1200/photosplitter-1767805726339.png,,"PremiumSOS Haar. Ziet je haar af van de kou? Dit kan je eraan doen
IJskoud weer en verwarming maken de lucht droog. Die droge lucht heeft een impact op je haar. Het wordt droog, statisch, kortom: on… [+188 chars]",,2026-01-25 10:49:27+00:00,random,,,
e41c6a93e7a0906eed3e75b257a70eba,2026-01-07T18:25:00Z,Storm,stormvloed nederland,www.gva.be,nl,0.2,"Mann (39) sitzt seit Monaten wegen Mordverdachts an seiner Partnerin (52) im Gefängnis, bestreitet aber jegliche Beteiligung. Der 39-jährige Muhammad D. aus Antwerpen wird verdächtigt, seinen Partner J. (52) in seinem Atelier in der Hertoginstraat in Antwerpen getötet zu haben. Die Frau starb im September im Bett. Der Mann wurde einen Monat später wegen des Verdachts des Totschlags festgenommen und ist...","Man (39) zit al maanden in de cel op verdenking van moord op partner (52), maar ontkent elke betrokkenheid",De 39-jarige Muhammad D. uit Antwerpen wordt ervan verdacht zijn partner J. (52) te hebben gedood in zijn studio in de Hertoginstraat in Antwerpen. De vrouw stierf in september in bed. De man werd een maand later aangehouden op verdenking van doodslag en zit …,"Man (39) has been in jail for months on suspicion of murdering his partner (52), but denies any involvement. 39-year-old Muhammad D. from Antwerp is suspected of killing his partner J. (52) in his studio in Hertoginstraat in Antwerp. The woman died in bed in September. The man was arrested a month later on suspicion of manslaughter and is...","Homo (39) per menses in carcere fuit propter suspicionem homicidii socium suum (52), sed nullam obligationem negat. Muhammad D. annos natus 39 ab Antverpia suspectus est J. socium suum necandi (52) in studio suo in Hertoginstraat Antverpiae. Femina mense Septembri in lecto mortua est. Vir post mensem comprehensus in suspicionem homicidii factus est.",https://www.gva.be/regio/antwerpen/regio-antwerpen/antwerpen/man-39-in-de-cel-na-dood-van-vrouw-in-zijn-studio-in-antwerpen-hij-ontkent-betrokkenheid-ik-werd-wakker-en-ze-was-overleden/122026831.html,https://prod-img.nieuwsblad.be/public/nieuws/pwn0kq-pxl-20260107-093431319.jpg/alternates/SIXTEEN_NINE_1200/PXL_20260107_093431319.jpg,,"PremiumSOS Haar. Ziet je haar af van de kou? Dit kan je eraan doen
IJskoud weer en verwarming maken de lucht droog. Die droge lucht heeft een impact op je haar. Het wordt droog, statisch, kortom: on… [+188 chars]",,2026-01-25 10:49:27+00:00,wmo,Netherlands,NEU,Europe
