index,published,topic,term,domain,language,valid,de,title,description,en,la,url,image,archive,content,quote,added,feed,country,ipcc,continent
a938e0dc060ee202aa0956ef1ae30f6f,2026-03-02T08:28:30Z,Wildfire,bosbrand,jeugdjournaal.nl,nl,0.9,"Kinder geben vor, Feuer zu sein: „Besonderes Gefühl“. Wie übt man für einen großen Waldbrand, ohne tatsächlich ein Feuer zu entfachen? Auf dem Land in Brabant setzten sie dafür Kinder der Jugendfeuerwehr ein. Während der großen Übung spielten die Kinder vor dem Feuer. Sie liefen in roten Regenmänteln durch die Natur, bereit…",Kinderen doen alsof ze vuur zijn: 'Apart gevoel',"Hoe oefen je voor een grote bosbrand, zonder echt vuur te maken? In de Brabantse natuur gebruikten ze daar kinderen van de jeugdbrandweer voor.
 Tijdens de grote oefening speelden de kinderen voor vuur. Met rode regenjassen aan liepen ze door de natuur, klaar…","Children pretend to be fire: 'Special feeling'. How do you practice for a large forest fire without actually starting a fire? In the Brabant countryside they used children from the youth fire brigade for this.
 During the big exercise the children played in front of the fire. They walked through nature wearing red raincoats, ready…","Pueri ignem esse fingunt: 'Special feeling'. Quomodo exerces ignem magnum silvam sine actu ignis? In Brabantiae agris pueri a iuventute hac LEGIO ignem utebantur.
 Per magnum exercitium pueri ante ignem ludunt. Ambulaverunt per naturam induti paenulas rubras, paratae...",https://jeugdjournaal.nl/l/2604625,https://cdn.nos.nl/image/2026/03/02/1332857/1280x720a.jpg,,"Hoe oefen je voor een grote bosbrand, zonder echt vuur te maken? In de Brabantse natuur gebruikten ze daar kinderen van de jeugdbrandweer voor.
Tijdens de grote oefening speelden de kinderen voor vu… [+249 chars]",,2026-03-05 03:16:34+00:00,random,,,
11da705bb6174345dce80d450bbbd5ce,2026-03-02T10:38:57Z,Landslide,aardverschuiving,www.nrc.nl,nl,0.9,"Die sizilianische Stadt Niscemi liegt am Rande einer Schlucht: „Der Erdrutsch hat ein bisschen Leben ausgesaugt.“ Erdrutsch: Einen Monat nach dem schweren Erdrutsch in der sizilianischen Stadt Niscemi können mehr als fünfzehnhundert Einwohner immer noch nicht nach Hause zurückkehren. Einige erlebten 1997 auch einen Erdrutsch. „Wir wussten nicht, dass das Leben hier gefährlich ist.“",De Siciliaanse stad Niscemi bungelt op de rand van een kloof: ‘De aardverschuiving zoog een stukje leven weg’,Aardverschuiving: Een maand na de zware aardverschuiving in de Siciliaanse stad Niscemi kunnen ruim vijftienhonderd bewoners nog niet terug naar huis. Sommigen maakten in 1997 ook al een aardverschuiving mee. „We beseften niet dat hier wonen gevaarlijk was.”,"The Sicilian town of Niscemi dangles on the edge of a gorge: 'The landslide sucked away a bit of life'. Landslide: A month after the serious landslide in the Sicilian city of Niscemi, more than fifteen hundred residents are still unable to return home. Some also experienced a landslide in 1997. “We didn't realize that living here was dangerous.”","Siculum oppidum Niscemi in ora fauces fluit: 'aliquantum vitae prolapsus abluit'. Landslide: Mensis post gravem ruinam in urbe Sicula Niscemi plus quam quindecim incolas adhuc domum reverti non possunt. Nonnulli etiam labrum experti sunt anno 1997. ""Nos nesciebamus hic habitare periculosum esse.""",https://www.nrc.nl/nieuws/2026/03/02/de-siciliaanse-stad-niscemi-bungelt-op-de-rand-van-een-kloof-de-aardverschuiving-zoog-een-stukje-leven-weg-a4921549,https://images.nrc.nl/DEOYxlEwXPUF6SAZPNVYLeTECJg=/1200x627/smart/filters:no_upscale()/s3/static.nrc.nl/wp-content/uploads/2026/02/27143723/010326BUI_2031807251_Niscemi1.jpg,,"In het gemeentehuis van Niscemi, een stad van ongeveer 25.000 inwoners in het zuidoosten van Sicilië, lopen bewoners de deur van burgemeester Massimiliano Conti plat. Burgemeester, wij zijn alles kwi… [+9996 chars]",,2026-03-07 03:04:56+00:00,random,,,
8caa28b22dee2124061c62543eb55c08,2026-03-03T10:09:45Z,Storm,stormvloed gebied 2 – matig,www.nrc.nl,nl,0.3,"Die Entscheidung über Krieg und Frieden kann nicht nur bei einem Mann liegen – und schon gar nicht bei diesem. Iran: Trump hätte den US-Kongress bitten sollen, einen Angriff auf den Iran zu genehmigen, oder von einem Angriff absehen sollen, schreibt David French.",De beslissing over oorlog en vrede kan niet bij slechts één man liggen – en zeker niet bij deze,"Iran: Trump had het Amerikaanse Congres om toestemming moeten vragen voor een aanval op Iran, of hij had van een aanval moeten afzien, schrijft David French.","The decision about war and peace cannot rest with just one man – and certainly not with this one. Iran: Trump should have asked the US Congress to authorize an attack on Iran or refrained from attacking, writes David French.","De bello et pace cum uno uno non potest consistere sententia, et certe non cum hoc uno. Iran: Trump petivisse Conventum US Congressum ut impetum in Irania permitteret vel ab oppugnatione abstineret, scribit David French.",https://www.nrc.nl/nieuws/2026/03/03/de-beslissing-over-oorlog-en-vrede-kan-niet-bij-slechts-een-man-liggen-en-zeker-niet-bij-deze-a4922024,https://images.nrc.nl/Gsg5a-ZbgqTQ8x08jpbPtJaAUXA=/1200x627/smart/filters:no_upscale()/s3/static.nrc.nl/wp-content/uploads/2026/03/03105204/030326OPI_2031985960_trump.jpg,,"Acht minuten.
Zolang duurde het filmpje waarmee president Trump op sociale media zijn oorlog met Iran aankondigde. Hij ging niet naar het Congres. Hij vroeg niet om een resolutie van de VN-Veilighei… [+10672 chars]",,2026-03-07 06:01:26+00:00,wmo,Paraguay,SES,South-America
e372aa2edf75e6868d57799c58edf15c,2026-03-03T20:10:10Z,Heat Wave,warme periode Nieuw-Zuid-Wales,www.nrc.nl,nl,0.3,"China ist für den Iran von größerer wirtschaftlicher Bedeutung als umgekehrt. Iran-Krieg: China ist einer der wichtigsten internationalen Partner Irans. Aber Peking agiert im Hinblick auf den Golfkrieg vorsichtig. „Sie sehen, wie China versucht, niemanden in der Region zu verärgern.“",Voor Iran is China van groter economisch belang dan andersom,Oorlog Iran: China is een van de belangrijkste internationale partners van Iran. Maar Beijing opereert behoedzaam rond de oorlog in de Golf. „Je ziet hoe China een poging doet om niemand in de regio voor het hoofd te stoten.”,China is of greater economic importance to Iran than the other way around. Iran War: China is one of Iran's most important international partners. But Beijing is operating cautiously around the war in the Gulf. “You see how China is making an attempt not to offend anyone in the region.”,"Sinae maioris momenti oeconomici in Irania est quam e converso. Bellum Iran: Sina est unus ex maximis internationalibus sociis Iran. Sed Beijing caute circa bellum in sinu operatur. ""Vides quomodo Sina conetur ne quis in regione offendat.""",https://www.nrc.nl/nieuws/2026/03/03/voor-iran-is-china-van-groter-economisch-belang-dan-andersom-a4922058,https://images.nrc.nl/HI013qsbiHZWS9qT_el8sCpTOR0=/1200x627/smart/filters:no_upscale()/s3/static.nrc.nl/wp-content/uploads/2026/03/03131926/030326BUI_2031993893_ChinaIran1.jpg,,Dat China de Amerikaanse en Israëlische aanvallen op Iran scherp zou veroordelen viel te verwachten. Minister van Buitenlandse Zaken Wang Yi noemde zondag de openlijke moord van een soevereine leider… [+5748 chars],,2026-03-07 06:01:26+00:00,acwe,Australia,EAU,Oceania
